<?xml version="1.0" encoding="UTF-8"?>

<!DOCTYPE application SYSTEM "../../dtd/application.dtd">
<application lang="en">
    <page-title>FBM room reservation</page-title>
    <months>
        <month>
            <full>January</full>
            <short>Jan</short>
        </month>
        <month>
            <full>February</full>
            <short>Feb</short>
        </month>
        <month>
            <full>March</full>
            <short>Mar</short>
        </month>
        <month>
            <full>April</full>
            <short>Apr</short>
        </month>
        <month>
            <full>May</full>
            <short>May</short>
        </month>
        <month>
            <full>June</full>
            <short>June</short>
        </month>
        <month>
            <full>July</full>
            <short>July</short>
        </month>
        <month>
            <full>August</full>
            <short>Aut</short>
        </month>
        <month>
            <full>September</full>
            <short>Sep</short>
        </month>
        <month>
            <full>October</full>
            <short>Oct</short>
        </month>
        <month>
            <full>November</full>
            <short>Nov</short>
        </month>
        <month>
            <full>December</full>
            <short>Dec</short>
        </month>
    </months>
    <days>
        <day>
            <full>Monday</full>
            <short>Mon</short>
        </day>
        <day>
            <full>Tuesday</full>
            <short>Tue</short>
        </day>
        <day>
            <full>Wednesday</full>
            <short>Wed</short>
        </day>
        <day>
            <full>Thursday</full>
            <short>Thu</short>
        </day>
        <day>
            <full>Friday</full>
            <short>Fri</short>
        </day>
        <day>
            <full>Saturday</full>
            <short>Sat</short>
        </day>
        <day>
            <full>Sunday</full>
            <short>Sun</short>
        </day>
    </days>
    <information-title>Informations</information-title>
    <calendar-choice>Choose calendar</calendar-choice>
    <go-to>Go to</go-to>
</application>
