<?xml version="1.0" encoding="UTF-8"?>

<!DOCTYPE application SYSTEM "../../dtd/application.dtd">
<application lang="fr">
    <page-title>Réservation des salles de la FBM</page-title>
    <months>
        <month>
            <full>Janvier</full>
            <short>Jan</short>
        </month>
        <month>
            <full>Février</full>
            <short>Fév</short>
        </month>
        <month>
            <full>Mars</full>
            <short>Mar</short>
        </month>
        <month>
            <full>Avril</full>
            <short>Avr</short>
        </month>
        <month>
            <full>Mai</full>
            <short>Mai</short>
        </month>
        <month>
            <full>Juin</full>
            <short>Juin</short>
        </month>
        <month>
            <full>Juillet</full>
            <short>Juil</short>
        </month>
        <month>
            <full>Août</full>
            <short>Août</short>
        </month>
        <month>
            <full>Septembre</full>
            <short>Sep</short>
        </month>
        <month>
            <full>Octobre</full>
            <short>Oct</short>
        </month>
        <month>
            <full>Novembre</full>
            <short>Nov</short>
        </month>
        <month>
            <full>Décembre</full>
            <short>Déc</short>
        </month>
    </months>
    <days>
        <day>
            <full>Lundi</full>
            <short>Lun</short>
        </day>
        <day>
            <full>Mardi</full>
            <short>Mar</short>
        </day>
        <day>
            <full>Mercredi</full>
            <short>Mer</short>
        </day>
        <day>
            <full>Jeudi</full>
            <short>Jeu</short>
        </day>
        <day>
            <full>Vendredi</full>
            <short>Ven</short>
        </day>
        <day>
            <full>Samedi</full>
            <short>Sam</short>
        </day>
        <day>
            <full>Dimanche</full>
            <short>Dim</short>
        </day>
    </days>
    <information-title>Informations</information-title>
    <calendar-choice>Choix du calendrier</calendar-choice>
    <go-to>Aller à</go-to>
</application>
